https://www.contractsfinder.service.gov.uk/Published/Notice/releases/52b96355-b038-45c3-920a-a78aa899a17c.json,2020-04-07T11:22:26Z,DUE NORTH LIMITED,GB-GOVUK-crown_comercial_service,,https://www.contractsfinder.service.gov.uk,1.1,https://raw.githubusercontent.com/open-contracting/ocds_process_title_extension/v1.1/extension.json,https://www.nationalarchives.gov.uk/doc/open-government-licence/version/2/,https://www.gov.uk/government/publications/open-contracting,ocds-b5fd17-99dfd278-f1cc-4028-a498-aa2fe1b5410a,ocds-b5fd17-99dfd278-f1cc-4028-a498-aa2fe1b5410a-353378-dar001-dn473941-53891578,en-GB,2020-04-07T11:22:26Z,award,tender,ocds-b5fd17-99dfd278-f1cc-4028-a498-aa2fe1b5410a-dar001-dn473941-53891578,P2020/2186/CS- Provision of Transport,PB2020/2186/CS- Provision of Transport for Route 21,complete,1,See description of related tender.,CPV,60000000,Transport services (excl. Waste transport),http://cpv.data.ac.uk/code-60000000.html,,,,,,,,,,,,,,,,,,,,,,,,,,,,,,,,,,,,,,,,,,,,,,,,,,,,,,,,,,,,,,,,,,,,,,,,,,,,,,,,,,,,,129600,GBP,129600,GBP,,Direct award,,,,,,,2020-02-01T00:00:00Z,,,1,Contract start,Anticipated contract start date,2020-02-03T00:00:00Z,,2,Contract end,Anticipated contract end date,2024-02-02T00:00:00Z,,1,,Services,,,,,,Darlington Borough Council,Town Hall Feethams,Darlington,,DL1 5QT,England,Claire Weatherburn,claire.weatherburn@darlington.gov.uk,1325405497,,http://www.darlington.gov.uk,3527795d-01ee-4cb4-bf30-89fdbfe574c0,,See description of related tender,active,2020-02-02T00:00:00Z,129600,GBP,0,,,,,1,,Delta Executive Travel,TS18 2PH,,,,,Mrs Judith Walton,,,,GBP,,,,,,,,,,,,,,,,,,,,,,,,,,,,,,,,,,,,,,,,,,,,,,,,,,,,,,,,,,,,,,,,,,,,,,,,,,,,
https://www.contractsfinder.service.gov.uk/Published/Notice/releases/3718cba1-7b15-4a5a-a2cf-952485ca203f.json,2020-04-07T11:20:02Z,BIP SOLUTIONS LIMITED,GB-GOVUK-crown_comercial_service,,https://www.contractsfinder.service.gov.uk,1.1,https://raw.githubusercontent.com/open-contracting/ocds_process_title_extension/v1.1/extension.json,https://www.nationalarchives.gov.uk/doc/open-government-licence/version/2/,https://www.gov.uk/government/publications/open-contracting,ocds-b5fd17-593d87ac-059d-490e-9da1-50fa1e2128ee,ocds-b5fd17-593d87ac-059d-490e-9da1-50fa1e2128ee-353377-bip486665942,en-GB,2020-04-07T11:20:02Z,award,tender,ocds-b5fd17-593d87ac-059d-490e-9da1-50fa1e2128ee-bip486665942,GB-hull: HR management system,Provision of a HR and Personnel management system.,complete,1,See description of related tender.,CPV,48000000,Software package and information systems,http://cpv.data.ac.uk/code-48000000.html,,,,,,,,,,,,,,,,,,,,,,,,,,,,,,,,,,,,,,,,,,,,,,,,,,,,,,,,,,,,,,,,,,,,,,,,,,,,,,,,,,,,,500000,GBP,0,GBP,,Not specified,,,,,,,2020-03-11T00:00:00Z,,,1,Contract start,Anticipated contract start date,2020-03-20T00:00:00Z,,2,Contract end,Anticipated contract end date,2027-03-26T00:00:00Z,,,,Services,,,,,,Humberside Fire & Rescue Service,Headquarters Summergroves Way,Hull,,HU4 7BB,UK,Mr Roger Burnham,rburnham@humbersidefire.gov.uk,1482567486,,,b32a2fbf-609c-4234-b143-6b1c1a33f034,,See description of related tender,active,2020-03-11T00:00:00Z,500000,GBP,0,,,,,,,Softcat PLC,"Solar House
        Fieldhouse Lane
        Marlow
        SL7 1LW",,,,,Mr Dominic Clark,,,,GBP,,,,,,,,,,,,,,,,,,,,,,,,,,,,,,,,,,,,,,,,,,,,,,,,,,,,,,,,,,,,,,,,,,,,,,,,,,,,
https://www.contractsfinder.service.gov.uk/Published/Notice/releases/e8d4bd15-17cb-4ee6-a74d-541c3a6268cc.json,2020-04-07T11:17:29Z,DUE NORTH LIMITED,GB-GOVUK-crown_comercial_service,,https://www.contractsfinder.service.gov.uk,1.1,https://raw.githubusercontent.com/open-contracting/ocds_process_title_extension/v1.1/extension.json,https://www.nationalarchives.gov.uk/doc/open-government-licence/version/2/,https://www.gov.uk/government/publications/open-contracting,ocds-b5fd17-a2e4ef26-e80d-4052-b591-c9353acb908c,ocds-b5fd17-a2e4ef26-e80d-4052-b591-c9353acb908c-353374-eastriding1-dn450840-86525529,en-GB,2020-04-07T11:17:29Z,award,tender,ocds-b5fd17-a2e4ef26-e80d-4052-b591-c9353acb908c-eastriding1-dn450840-86525529,2195-20 Specialist Enforcement Services,2195-20 Specialist Enforcement Services,complete,1,See description of related tender.,CPV,75240000,"Public security, law and order services",http://cpv.data.ac.uk/code-75240000.html,,,,,,,,,,,,,,,,,,,,,,,,,,,,,,,,,,,,,,,,,,,,,,,,,,,,,,,,,,,,,,,,,,,,,,,,,,,,,,,,,,,,,300000,GBP,0,GBP,,Open procedure,,,,,,,2020-01-14T00:00:00Z,,,1,Contract start,Anticipated contract start date,2020-04-01T00:00:00Z,,2,Contract end,Anticipated contract end date,2024-03-31T00:00:00Z,,1,1,Services,,,,,,East Riding of Yorkshire Council,County Hall Cross Street,Beverley,,HU17 9BA,England,Will Monk,will.monk@eastriding.gov.uk,+44 1482395341,,http://www.eastriding.gov.uk,7794fc83-cbaa-4e28-a14e-12facc6f4680,,See description of related tender,active,2020-03-20T00:00:00Z,247000,GBP,0,,,,,1,,High Court Enforcement Group Limited,"Marine House, 2 Marine Road, Colwyn Bay, Conwy, LL29 8PH",,,,,,,,,GBP,,,,,,,,,,,,,,,,,,,,,,,,,,,,,,,,,,,,,,,,,,,,,,,,,,,,,,,,,,,,,,,,,,,,,,,,,,,,
https://www.contractsfinder.service.gov.uk/Published/Notice/releases/cb036970-1d99-47c4-8483-6ba11a382275.json,2020-04-07T11:17:23Z,BRAVOSOLUTION UK LIMITED,GB-GOVUK-crown_comercial_service,,https://www.contractsfinder.service.gov.uk,1.1,https://raw.githubusercontent.com/open-contracting/ocds_process_title_extension/v1.1/extension.json,https://www.nationalarchives.gov.uk/doc/open-government-licence/version/2/,https://www.gov.uk/government/publications/open-contracting,ocds-b5fd17-e1dd4cb9-fd8d-48b5-a6da-add4cb1a0aa6,ocds-b5fd17-e1dd4cb9-fd8d-48b5-a6da-add4cb1a0aa6-353373-tender_238145-849142,en-GB,2020-04-07T11:17:23Z,tender,tender,ocds-b5fd17-e1dd4cb9-fd8d-48b5-a6da-add4cb1a0aa6-tender_238145,Wet Room Replacement - Phase 5,"The London Borough of Hillingdon is seeking a suitably experienced contractor to deliver (as the sole main-contractor) a programme of Wet Room replacements over an agreed programme period of various occupied domestic dwellings in Hillingdon.

List of Properties

-	2, South Walk, Hayes, UB3 5DX
-	15, Reid close, Eastcote, HA5 2QD
-	48, Acre way, Northwood, HA6 1SX
-	73a Manor Waye, Uxbridge
-	136, Ash Grove, Harefield UB9 6HA
-	Flat 158, Sutcliffe House, Addison Way
-	Flat 7 Gower House, Barra Hall UB3 2NP
-	4, Radnor Grove Uxbridge UB10 0ET
-	Flat 8 Cottesmore House, Perkins Gardens, UB10 8FT
-	18, Heathfield Rise, Ruislip, HA4 7NE
-	37, Stratford Road, Hayes, UB4 9EW
-	43, Cherry Orchard, UB7 7JR
-	48, Columbus Gardens, HA6 1TL
-	77 Bridge Road, UB8 2QW
-	140, Waltham Avenue, Hayes, UB3 1TE
-	Flat 76, Melbourne House, Yeading Lane, UB4 9LL
-	28, Addison Way, Northwood, HA6 1 SY 

The proposed contract will be for a period of approximately 8 weeks as agreed with the successful Contractor.",active,1,See description of related tender.,CPV,45211310,Bathrooms construction work,http://cpv.data.ac.uk/code-45211310.html,2,See description of related tender.,CPV,45332200,Water plumbing work,http://cpv.data.ac.uk/code-45332200.html,3,See description of related tender.,CPV,50000000,Repair and maintenance services,http://cpv.data.ac.uk/code-50000000.html,4,See description of related tender.,CPV,51000000,Installation services (except software),http://cpv.data.ac.uk/code-51000000.html,,,,,,,,,,,,,,,,,,,,,,,,,,,,,,,,,,,,,,,,,,,,,,,,,,,,,,,,,,,,,,,,,,,75000,GBP,0,GBP,open,Open (non-OJEU),,,,,"Please apply directly to the buyer using the contact details provided, or follow the instructions given in the notice description or information section.",2020-04-07T11:17:23Z,2020-04-28T00:00:00Z,,,1,Contract start,Anticipated contract start date,2020-08-03T00:00:00Z,,2,Contract end,Anticipated contract end date,2020-09-28T00:00:00Z,,1,,Works,,,,,,London Borough of Hillingdon,"Civic Centre, London Borough of Hillingdon ",Uxbridge,,UB8 1UW,England,Wayne Toovey,procurement@hillingdon.gov.uk,,,,,,,,,,,,,,,,,,,,,,,,,,,,,,,,,,,,,,,,,,,,,,,,,,,,,,,,,,,,,,,,,,,,,,,,,,,,,,,,,,,,,,,,,,,,,,,,,,,,,,,,
https://www.contractsfinder.service.gov.uk/Published/Notice/releases/471d6669-56c0-42cb-9443-949644a2ff98.json,2020-04-07T11:17:14Z,DUE NORTH LIMITED,GB-GOVUK-crown_comercial_service,,https://www.contractsfinder.service.gov.uk,1.1,https://raw.githubusercontent.com/open-contracting/ocds_process_title_extension/v1.1/extension.json,https://www.nationalarchives.gov.uk/doc/open-government-licence/version/2/,https://www.gov.uk/government/publications/open-contracting,ocds-b5fd17-617350e3-f78c-4c75-81c9-1c6e87870b09,ocds-b5fd17-617350e3-f78c-4c75-81c9-1c6e87870b09-353372-wyre002-dn473951-46565707,en-GB,2020-04-07T11:17:14Z,tender,tender,ocds-b5fd17-617350e3-f78c-4c75-81c9-1c6e87870b09-wyre002-dn473951-46565707,Contract for the Provision of Blackberry Secure UEM and Productivity Suite - Choice - User Licenses,"Wyre Forest District Council  wishes to appoint a Contractor to provide BlackBerry Secure UEM and Productivity Suite Choice User Licenses. The appointment will be by way of competitive Tender via the Open Route. The current licenses are valid until 4th May 2020.
To ensure compliance we will only accept bids from certified partners that specialise in software licensing for Blackberry volume agreements, WFDC will not purchase via a third party.
The deadline for submissions to Procontract Due North is 5pm Wednesday 15th April 2020.
DN473951
https://procontract.due-north.com/Login",active,1,See description of related tender.,CPV,48200000,"Networking, Internet and intranet software package",http://cpv.data.ac.uk/code-48200000.html,,,,,,,,,,,,,,,,,,,,,,,,,,,,,,,,,,,,,,,,,,,,,,,,,,,,,,,,,,,,,,,,,,,,,,,,,,,,,,,,,,,,,10000,GBP,0,GBP,,Open procedure,,,,,"Please apply directly to the buyer using the contact details provided, or follow the instructions given in the notice description or information section.",2020-04-07T11:17:14Z,2020-04-15T00:00:00Z,,,1,Contract start,Anticipated contract start date,2020-05-04T00:00:00Z,,2,Contract end,Anticipated contract end date,2021-04-03T00:00:00Z,,1,,Products,,,,,,Wyre Forest District Council,Wyre Forest House Finepoint Way,Kidderminster,,DY11 7WF,England,Jackie Reed,procurement@wyreforestdc.gov.uk,+44 1562732928,,https://procontract.due-north.com/Login,,,,,,,,,,,,,,,,,,,,,,,,,,,,,,,,,,,,,,,,,,,,,,,,,,,,,,,,,,,,,,,,,,,,,,,,,,,,,,,,,,,,,,,,,,,,,,,,,,,,,
https://www.contractsfinder.service.gov.uk/Published/Notice/releases/ecbfad94-62b5-49b3-ae22-5f3c46b1c1d9.json,2020-04-07T11:12:57Z,Crown Commercial Service,GB-GOVUK-crown_comercial_service,,https://www.contractsfinder.service.gov.uk,1.1,https://raw.githubusercontent.com/open-contracting/ocds_process_title_extension/v1.1/extension.json,https://www.nationalarchives.gov.uk/doc/open-government-licence/version/2/,https://www.gov.uk/government/publications/open-contracting,ocds-b5fd17-82520039-06e6-4e71-880e-d1e13a586b02,ocds-b5fd17-82520039-06e6-4e71-880e-d1e13a586b02-353368-cccc20a14.,en-GB,2020-04-07T11:12:57Z,award,tender,ocds-b5fd17-82520039-06e6-4e71-880e-d1e13a586b02-cccc20a14.,The Provision of Employee Authentication Service - Replacement (EAS-R) Audit,For further information please see attached documentation.,complete,1,See description of related tender.,CPV,71241000,"Feasibility study, advisory service, analysis",http://cpv.data.ac.uk/code-71241000.html,2,See description of related tender.,CPV,79212000,Auditing services,http://cpv.data.ac.uk/code-79212000.html,,,,,,,,,,,,,,,,,,,,,,,,,,,,,,,,,,,,,,,,,,,,,,,,,,,,,,,,,,,,,,,,,,,,,,,,,,,,,,,63057.5,GBP,63057.5,GBP,direct,Single tender action (non-OJEU),,,,,,,2020-02-20T00:00:00Z,,,1,Contract start,Anticipated contract start date,2020-03-03T00:00:00Z,,2,Contract end,Anticipated contract end date,2020-04-10T00:00:00Z,,,,Services,,,,,,Department for Work and Pensions : Department for Work and Pensions,"Floor 9, The Capital Building, Old Hall Street",Liverpool,,L3 9PP,England,Crown Commercial Service on behalf of Department for Work and Pensions : Department for Work and Pensions,supplier@crowncommercial.gov.uk,3450103503,,https://www.gov.uk/government/organisations/crown-commercial-service,348b0024-12ae-4236-9c7b-4f047cdd4c57,,See description of related tender,active,2020-02-27T00:00:00Z,63057.5,GBP,0,,,,,,,KPMG LLP,8 Salisbury Square EC4Y 8BB London England,,,,,,,,,GBP,,,,,,,,,,,,,,,,,,,,,,,,,,,,,,,,,,,,,,,,,,,,,,,,,,,,,,,,,,,,,,,,,,,,,,,,,,,,
https://www.contractsfinder.service.gov.uk/Published/Notice/releases/80e32f8b-3955-47df-b969-92eeac538921.json,2020-04-07T11:12:29Z,Driver & Vehicle Licensing Agency,GB-GOVUK-crown_comercial_service,,https://www.contractsfinder.service.gov.uk,1.1,https://raw.githubusercontent.com/open-contracting/ocds_process_title_extension/v1.1/extension.json,https://www.nationalarchives.gov.uk/doc/open-government-licence/version/2/,https://www.gov.uk/government/publications/open-contracting,ocds-b5fd17-97838d92-331a-4b2b-bdec-35a478798878,ocds-b5fd17-97838d92-331a-4b2b-bdec-35a478798878-353367-ps-19-161,en-GB,2020-04-07T11:12:29Z,award,tender,ocds-b5fd17-97838d92-331a-4b2b-bdec-35a478798878-ps/19,Provision of Market Research Recruitment,"To procure a two year contract for a specialist supplier to recruit research participants on our behalf. This contract will provide participants for a series of focus groups, mini groups, depth interviews, usability test and other forms of qualitative research across the United Kingdom, speaking to a wide range of customer segments. Research will take place in the Agencies UX Lab, other labs, syndicate rooms, meeting rooms in hotels and in participants homes or workplaces.

Our route to market was via an existing government Digital Marketplace Framework.",complete,1,See description of related tender.,CPV,79310000,Market research services,http://cpv.data.ac.uk/code-79310000.html,,,,,,,,,,,,,,,,,,,,,,,,,,,,,,,,,,,,,,,,,,,,,,,,,,,,,,,,,,,,,,,,,,,,,,,,,,,,,,,,,,,,,150000,GBP,0,GBP,selective,Call off from a Framework Agreement,,,,,,,2020-02-07T00:00:00Z,,,1,Contract start,Anticipated contract start date,2020-04-08T00:00:00Z,,2,Contract end,Anticipated contract end date,2022-04-07T00:00:00Z,,,,Services,,GB-SRS,sid4gov.cabinetoffice.gov.uk/NsBK36A7,https://supplierregistration.cabinetoffice.gov.uk/notices/buyers.csv,,Driver & Vehicle Licensing Agency,Longview Road ,Swansea,,SA6 7JL,Wales,Dale Best,dale.best@dvla.gov.uk,01792 788214,,,17166842-b227-4c7a-9e72-bbcaf0762036,,See description of related tender,active,2020-04-07T00:00:00Z,150000,GBP,0,GB-COH,3210409,,,,,CRITERIA FIELDWORK LIMITED,"1A Frognal
NW3 6AL
GB",,,,,,,,,GBP,,,,,,,,,,,,,,,,,,,,,,,,,,,,,,,,,,,,,,,,,,,,,,,,,,,,,,,,,,,,,,,,,,,,,,,,,,,,
https://www.contractsfinder.service.gov.uk/Published/Notice/releases/e52fad3c-ed50-4b01-a649-d87dc3819451.json,2020-04-07T11:10:11Z,DUE NORTH LIMITED,GB-GOVUK-crown_comercial_service,,https://www.contractsfinder.service.gov.uk,1.1,https://raw.githubusercontent.com/open-contracting/ocds_process_title_extension/v1.1/extension.json,https://www.nationalarchives.gov.uk/doc/open-government-licence/version/2/,https://www.gov.uk/government/publications/open-contracting,ocds-b5fd17-2244bdf5-6289-49e6-be88-23f3eb3380f7,ocds-b5fd17-2244bdf5-6289-49e6-be88-23f3eb3380f7-353371-ncl001-dn449838-16047551,en-GB,2020-04-07T11:10:11Z,tender,tender,ocds-b5fd17-2244bdf5-6289-49e6-be88-23f3eb3380f7-ncl001-dn449838-16047551,"(NU/1539) Supply, maintenance and support of a Digital Assessment System","Newcastle University requires looking for a digital exam system to support the provision of authentic summative assessments in a secure digital environment.   

The University recently completed a market engagement stage (under PIN 2019/S 231-566529) and the purpose of this notice is to alert the market of this OJEU Open Procedure to invite tenders to meet the requirements as described in the ITT documentation.

Expressions of interest in this project can be made by registering via the University's e-tendering portal at: https://procontract.due-north.com/Advert/Index?advertId=a067c403-1b62-ea11-80ff-005056b64545

The contract reference is NU/1539.
The deadline for expressing an interest is Friday 1st May 2020 at 12:00 BST.",active,1,See description of related tender.,CPV,48000000,Software package and information systems,http://cpv.data.ac.uk/code-48000000.html,,,,,,,,,,,,,,,,,,,,,,,,,,,,,,,,,,,,,,,,,,,,,,,,,,,,,,,,,,,,,,,,,,,,,,,,,,,,,,,,,,,,,725000,GBP,0,GBP,,Open procedure,,,,,"Please apply directly to the buyer using the contact details provided, or follow the instructions given in the notice description or information section.",2020-04-07T11:10:11Z,2020-05-06T00:00:00Z,,,1,Contract start,Anticipated contract start date,2020-07-15T00:00:00Z,,2,Contract end,Anticipated contract end date,2025-09-06T00:00:00Z,,1,,Services,,,,,,Newcastle University,"Newcastle University Procurement Services, Kingsgate",Newcastle,,NE1 7RU,England,Dave Anderson,dave.anderson@ncl.ac.uk,+44 1912085360,,,,,,,,,,,,,,,,,,,,,,,,,,,,,,,,,,,,,,,,,,,,,,,,,,,,,,,,,,,,,,,,,,,,,,,,,,,,,,,,,,,,,,,,,,,,,,,,,,,,,,,
https://www.contractsfinder.service.gov.uk/Published/Notice/releases/813301d8-0fb1-4d0d-baad-84e4a171269a.json,2020-04-07T11:04:18Z,ADB (UK) LIMITED,GB-GOVUK-crown_comercial_service,,https://www.contractsfinder.service.gov.uk,1.1,https://raw.githubusercontent.com/open-contracting/ocds_process_title_extension/v1.1/extension.json,https://www.nationalarchives.gov.uk/doc/open-government-licence/version/2/,https://www.gov.uk/government/publications/open-contracting,ocds-b5fd17-99699efc-0b77-44cb-be48-8d0e9f796055,ocds-b5fd17-99699efc-0b77-44cb-be48-8d0e9f796055-353365-ra282231,en-GB,2020-04-07T11:04:18Z,tender,tender,ocds-b5fd17-99699efc-0b77-44cb-be48-8d0e9f796055-ra282231,RA282231 - Covid 19 - Thumb Loop Gowns and Coveralls,"Please provide a price for the items listed or suitable alternatives, a nominal volume has been indicated, please can suppliers indicate what stocks they have available and box sizes if relevant. Any Carriage charges and lead times must be indicated. All products must be CE marked and meet the minimum requirements stated. - To access this competition: login to https://suppliers.multiquote.com and view the opportunity RA282231. Not registered on MultiQuote - visit https://suppliers.multiquote.com then register and quote RA282231 as the reason for registration. Any queries please contact MultiQuote on 0151 482 9230.",active,1,See description of related tender.,CPV,18000000,"Clothing, footwear, luggage articles and accessories",http://cpv.data.ac.uk/code-18000000.html,,,,,,,,,,,,,,,,,,,,,,,,,,,,,,,,,,,,,,,,,,,,,,,,,,,,,,,,,,,,,,,,,,,,,,,,,,,,,,,,,,,,,0,GBP,0,GBP,,Open procedure,,,,,"Please apply directly to the buyer using the contact details provided, or follow the instructions given in the notice description or information section.",2020-04-07T11:04:18Z,2020-04-09T00:00:00Z,,,1,Contract start,Anticipated contract start date,2020-04-09T00:00:00Z,,2,Contract end,Anticipated contract end date,2020-04-09T00:00:00Z,,1,,Products,,,,,,Shropshire Healthcare Procurement Service,2 Douglas Court Anchorage Avenue,Shrewsbury,,SY3 8XQ,England,Andrea Phillips,support@multiquote.com,0151 482 9230,,https://suppliers.multiquote.com,,,,,,,,,,,,,,,,,,,,,,,,,,,,,,,,,,,,,,,,,,,,,,,,,,,,,,,,,,,,,,,,,,,,,,,,,,,,,,,,,,,,,,,,,,,,,,,,,,,,,
https://www.contractsfinder.service.gov.uk/Published/Notice/releases/6516d22f-01fe-4877-9398-236b530b086f.json,2020-04-07T11:04:17Z,DUE NORTH LIMITED,GB-GOVUK-crown_comercial_service,,https://www.contractsfinder.service.gov.uk,1.1,https://raw.githubusercontent.com/open-contracting/ocds_process_title_extension/v1.1/extension.json,https://www.nationalarchives.gov.uk/doc/open-government-licence/version/2/,https://www.gov.uk/government/publications/open-contracting,ocds-b5fd17-ca456a22-0df9-447d-9ec9-79e0b6193f34,ocds-b5fd17-ca456a22-0df9-447d-9ec9-79e0b6193f34-353366-npsbarns001-dn456600-71910101,en-GB,2020-04-07T11:04:17Z,award,tender,ocds-b5fd17-ca456a22-0df9-447d-9ec9-79e0b6193f34-npsbarns001-dn456600-71910101,"Supply of Meat, Meat Products, Poultry and Game to the Schools","Supply of Meat, Meat Products, Poultry and Game to the Schools",complete,1,See description of related tender.,CPV,15100000,"Animal products, meat and meat products",http://cpv.data.ac.uk/code-15100000.html,,,,,,,,,,,,,,,,,,,,,,,,,,,,,,,,,,,,,,,,,,,,,,,,,,,,,,,,,,,,,,,,,,,,,,,,,,,,,,,,,,,,,204000,GBP,204000,GBP,,Open procedure,,,,,,,2019-12-30T00:00:00Z,,,1,Contract start,Anticipated contract start date,2020-01-01T00:00:00Z,,2,Contract end,Anticipated contract end date,2021-03-31T00:00:00Z,,,,Products,,,,,,Barnsley Metropolitan Borough Council,Westgate Plaza One PO Box 601,Barnsley,,S70 9FA,United Kingdom,Charlotte Watson,Charlottewatson@barnsley.gov.uk,+44 1226787533,,https://www.yortender.co.uk,d55ba208-c7bb-4294-ae84-3b5d310b9ae3,,See description of related tender,active,2019-12-31T00:00:00Z,204000,GBP,0,,,,,,,J W YOUNG (BUTCHERS) LTD,S9 3WG,,,,,DAVID WILLIAMS,,,,GBP,,,,,,,,,,,,,,,,,,,,,,,,,,,,,,,,,,,,,,,,,,,,,,,,,,,,,,,,,,,,,,,,,,,,,,,,,,,,
https://www.contractsfinder.service.gov.uk/Published/Notice/releases/55ee1813-08b2-46a9-905a-19d7240046c5.json,2020-04-07T10:51:41Z,DUE NORTH LIMITED,GB-GOVUK-crown_comercial_service,,https://www.contractsfinder.service.gov.uk,1.1,https://raw.githubusercontent.com/open-contracting/ocds_process_title_extension/v1.1/extension.json,https://www.nationalarchives.gov.uk/doc/open-government-licence/version/2/,https://www.gov.uk/government/publications/open-contracting,ocds-b5fd17-edd71062-8d2c-4061-b6bf-d45ffbe41fff,ocds-b5fd17-edd71062-8d2c-4061-b6bf-d45ffbe41fff-353363-lbowf001-dn470065-74591712,en-GB,2020-04-07T10:51:41Z,tender,tender,ocds-b5fd17-edd71062-8d2c-4061-b6bf-d45ffbe41fff-lbowf001-dn470065-74591712,Units 6/7 Lockwood Way E17 - Targeted Asbestos R&D Survey,Units 6/7 Lockwood Way E17 - Targeted Asbestos R&D Survey,active,1,See description of related tender.,CPV,45000000,Construction work,http://cpv.data.ac.uk/code-45000000.html,,,,,,,,,,,,,,,,,,,,,,,,,,,,,,,,,,,,,,,,,,,,,,,,,,,,,,,,,,,,,,,,,,,,,,,,,,,,,,,,,,,,,1000,GBP,1000,GBP,,Not applicable,,,,,"Please apply directly to the buyer using the contact details provided, or follow the instructions given in the notice description or information section.",2020-04-07T10:51:41Z,2020-04-08T00:00:00Z,,,1,Contract start,Anticipated contract start date,2020-04-11T00:00:00Z,,2,Contract end,Anticipated contract end date,2020-05-31T00:00:00Z,,1,,Services,,,,,,London Borough of Waltham Forest,The Magistrate's 1 Farnan Avenue,Walthamstow,,E17 4NX,England,Ashana Jones,ashana.jones@walthamforest.gov.uk,+44 2084964137,,http://www.walthamforest.gov.uk/,,,,,,,,,,,,,,,,,,,,,,,,,,,,,,,,,,,,,,,,,,,,,,,,,,,,,,,,,,,,,,,,,,,,,,,,,,,,,,,,,,,,,,,,,,,,,,,,,,,,,
https://www.contractsfinder.service.gov.uk/Published/Notice/releases/2725df7d-b937-4c3b-abf7-dfac9a28da26.json,2020-04-07T10:51:10Z,"ROYAL BOTANIC GARDENS, KEW",GB-GOVUK-crown_comercial_service,,https://www.contractsfinder.service.gov.uk,1.1,https://raw.githubusercontent.com/open-contracting/ocds_process_title_extension/v1.1/extension.json,https://www.nationalarchives.gov.uk/doc/open-government-licence/version/2/,https://www.gov.uk/government/publications/open-contracting,ocds-b5fd17-662f720a-8e1c-429f-b767-a9026bc7a7fc,ocds-b5fd17-662f720a-8e1c-429f-b767-a9026bc7a7fc-353360-rbgkew-820,en-GB,2020-04-07T10:51:10Z,award,tender,ocds-b5fd17-662f720a-8e1c-429f-b767-a9026bc7a7fc-rbgkew,"Magento 1 to Magento 2 development, hosting & support","Requirement: Magento 2 development with Magento 1 Data Migration, hosting and support

Framework: CCS, G Cloud 11",complete,1,See description of related tender.,CPV,48000000,Software package and information systems,http://cpv.data.ac.uk/code-48000000.html,2,See description of related tender.,CPV,72000000,"IT services: consulting, software development, Internet and support",http://cpv.data.ac.uk/code-72000000.html,,,,,,,,,,,,,,,,,,,,,,,,,,,,,,,,,,,,,,,,,,,,,,,,,,,,,,,,,,,,,,,,,,,,,,,,,,,,,,,80000,GBP,0,GBP,selective,Call off from a Framework Agreement,,,,,,,2020-02-07T00:00:00Z,,,1,Contract start,Anticipated contract start date,2020-02-25T00:00:00Z,,2,Contract end,Anticipated contract end date,2021-06-30T00:00:00Z,,,,Services,,GB-SRS,sid4gov.cabinetoffice.gov.uk/EM5q33BA,https://supplierregistration.cabinetoffice.gov.uk/notices/buyers.csv,,"ROYAL BOTANIC GARDENS, KEW",Kew Green ,RICHMOND,,TW93AE,England,,procurement@kew.org,,,,3e64c17a-4209-4bd8-9edc-14ef8c966bde,,See description of related tender,active,2020-02-25T00:00:00Z,81500,GBP,0,GB-COH,4884651,,,,,CTI DIGITAL LIMITED,"Express Networks 2,3 George Leigh Street
MANCHESTER
M4 5DL
GB",,,,,,,,,GBP,,,,,,,,,,,,,,,,,,,,,,,,,,,,,,,,,,,,,,,,,,,,,,,,,,,,,,,,,,,,,,,,,,,,,,,,,,,,
