https://www.contractsfinder.service.gov.uk/Published/Notice/releases/19cf4dce-722b-4be7-ad1f-abef5eed0648.json,2020-04-07T13:50:17Z,BRAVOSOLUTION UK LIMITED,GB-GOVUK-crown_comercial_service,,https://www.contractsfinder.service.gov.uk,1.1,https://raw.githubusercontent.com/open-contracting/ocds_process_title_extension/v1.1/extension.json,https://www.nationalarchives.gov.uk/doc/open-government-licence/version/2/,https://www.gov.uk/government/publications/open-contracting,ocds-b5fd17-ca5807a7-11d8-49f7-8c3c-7e356b500006,ocds-b5fd17-ca5807a7-11d8-49f7-8c3c-7e356b500006-353426-tender_238125-849095,en-GB,2020-04-07T13:50:17Z,award,tender,ocds-b5fd17-ca5807a7-11d8-49f7-8c3c-7e356b500006-tender_238125,Community Paediatric Nutrition Prescribing Support Dietitian (PSD) Service for Mid Essex Clinical Commissioning Group,"This is a Contract Award Notice to communicate NHS Mid Essex Clinical Commissioning Group's recent contract award to Oviva UK Limited for the provision of technology-enabled, community paediatric nutrition prescribing support dietitian (PSD) service for a period of 12 months.
The CCG commissioned a pilot technology-enabled, community paediatric nutrition prescribing support dietitian (PSD) service from Oviva UK Limited in May 2018, following a procurement process. This provider also delivers a paediatric home enteral feed dietetic service in Mid Essex and cow's milk allergy services for the South East Essex CCGs. 
The CCG is currently preparing for an STP merger with the South Essex Clinical Commissioning Groups with the aim of being a single organisation by April 2021. As such, the CCG has made the decision that working with their existing provider to continue to develop the service by extending the pilot will be the best solution to provide a technology-enabled, community paediatric nutrition prescribing support dietitian (PSD) service for Mid Essex until the new organisation is in a position to make strategic commissioning decisions for future provision of community dietetics for the STP.
The CCG is publishing this Contract Award Notice in the Contracts Finder in accordance with the Public Contracts Regulations 2015 for spend above £25,000.The Services in scope of this Contract Award Notice fall within 'social and other specific services' within the Public Contracts Regulations 2015 (the Regulations) but the total contract value of £70,000 does not exceed the current threshold of £663,540.",complete,1,See description of related tender.,CPV,85323000,Community health services,http://cpv.data.ac.uk/code-85323000.html,,,,,,,,,,,,,,,,,,,,,,,,,,,,,,,,,,,,,,,,,,,,,,,,,,,,,,,,,,,,,,,,,,,,,,,,,,,,,,,,,,,,,70000,GBP,0,GBP,direct,Single tender action (non-OJEU),,,,,,,2020-03-24T00:00:00Z,,,1,Contract start,Anticipated contract start date,2020-05-01T00:00:00Z,,2,Contract end,Anticipated contract end date,2021-04-30T00:00:00Z,,1,,Services,,,,,,Attain,"Wren House, Colchester Road ",Chelmsford,,CM2 5PF,England,NHS Mid Essex Clinical Commissioning Group,amy.wilson@attain.co.uk,,,,b6cf1c5e-5287-47c9-bd38-d29eb5e575ca,,See description of related tender,active,2020-03-24T00:00:00Z,70000,GBP,0,,,,,1,,Oviva UK Limited,"Ground Floor, 3 Risborough Street, London, SE1 0HF, United Kingdom",,,,,,,,,GBP,,,,,,,,,,,,,,,,,,,,,,,,,,,,,,,,,,,,,,,,,,,,,,,,,,,,,,,,,,,,,,,,,,,,,,,,,,,,
https://www.contractsfinder.service.gov.uk/Published/Notice/releases/05af4617-0c70-408d-8238-93cd1142924e.json,2020-04-07T13:49:05Z,BRAVOSOLUTION UK LIMITED,GB-GOVUK-crown_comercial_service,,https://www.contractsfinder.service.gov.uk,1.1,https://raw.githubusercontent.com/open-contracting/ocds_process_title_extension/v1.1/extension.json,https://www.nationalarchives.gov.uk/doc/open-government-licence/version/2/,https://www.gov.uk/government/publications/open-contracting,ocds-b5fd17-c81a0598-13c9-43c9-8b33-e53347dd1980,ocds-b5fd17-c81a0598-13c9-43c9-8b33-e53347dd1980-353425-tender_225292-849201,en-GB,2020-04-07T13:49:05Z,award,tender,ocds-b5fd17-c81a0598-13c9-43c9-8b33-e53347dd1980-tender_225292,HPFT - Integration Engine,A sub OJEU threshold tender was conducted for Integration Engine and Maintenance at Hertfordshire Partnership University NHS Foundation Trust. The most economically advantageous solution was awarded the contract - maintenance with an optional +1 year +1 +1,complete,1,See description of related tender.,CPV,48000000,Software package and information systems,http://cpv.data.ac.uk/code-48000000.html,,,,,,,,,,,,,,,,,,,,,,,,,,,,,,,,,,,,,,,,,,,,,,,,,,,,,,,,,,,,,,,,,,,,,,,,,,,,,,,,,,,,,90000,GBP,120000,GBP,,Other - Sub-OJEU tender,,,,,,,2020-01-13T00:00:00Z,,,1,Contract start,Anticipated contract start date,2020-03-23T00:00:00Z,,2,Contract end,Anticipated contract end date,2021-03-22T00:00:00Z,,1,,Products,,,,,,Hertfordshire NHS Procurement,"2nd Floor, Gate House, Fretherne Road",Welwyn Garden City,,AL8 6NS,England,David McGrath,david.mcgrath3@nhs.net,,,,a6d51c12-1551-4a3c-8af8-4e58f75c8f0b,,See description of related tender,active,2020-02-05T00:00:00Z,90000,GBP,0,,,,,,,Enovacom,"521 Avenue du Prado, Marseillel, Middlesex, EX5 5AG, UNITED KINGDOM",,,,,MARK SMITH,,,,GBP,,,,,,,,,,,,,,,,,,,,,,,,,,,,,,,,,,,,,,,,,,,,,,,,,,,,,,,,,,,,,,,,,,,,,,,,,,,,
https://www.contractsfinder.service.gov.uk/Published/Notice/releases/928e9b28-bd98-46d1-81c5-034b705bb67d.json,2020-04-07T13:44:58Z,DUE NORTH LIMITED,GB-GOVUK-crown_comercial_service,,https://www.contractsfinder.service.gov.uk,1.1,https://raw.githubusercontent.com/open-contracting/ocds_process_title_extension/v1.1/extension.json,https://www.nationalarchives.gov.uk/doc/open-government-licence/version/2/,https://www.gov.uk/government/publications/open-contracting,ocds-b5fd17-39b01dc4-eb1e-49d2-8029-8ec942d7003f,ocds-b5fd17-39b01dc4-eb1e-49d2-8029-8ec942d7003f-353423-eastriding1-dn467989-71220510,en-GB,2020-04-07T13:44:58Z,award,tender,ocds-b5fd17-39b01dc4-eb1e-49d2-8029-8ec942d7003f-eastriding1-dn467989-71220510,2273a-20 Office Machinery,This is a 45 Month framework for the Supply of Office Machinery and Supplies to East Riding of Yorkshire Council Supplies Department.,complete,1,See description of related tender.,CPV,30000000,"Office and computing machinery, equipment and supplies except furniture and software packages",http://cpv.data.ac.uk/code-30000000.html,,,,,,,,,,,,,,,,,,,,,,,,,,,,,,,,,,,,,,,,,,,,,,,,,,,,,,,,,,,,,,,,,,,,,,,,,,,,,,,,,,,,,17400,GBP,0,GBP,,Open procedure,,,,,,,2020-04-01T00:00:00Z,,,1,Contract start,Anticipated contract start date,2020-04-08T00:00:00Z,,2,Contract end,Anticipated contract end date,2023-12-31T00:00:00Z,,1,,Products,,,,,,East Riding of Yorkshire,County Hall Cross Street,Beverley,,HU17 9BA,England,Mirheta Huremovic,mirheta.huremovic@eastriding.gov.uk,+44 1482395336,,http://www.eastriding.gov.uk,b843e4d3-96e4-4e9e-90d8-be975577a531,,See description of related tender,active,2020-04-07T00:00:00Z,17400,GBP,0,,,,,,,Acco Brands UK Ltd,"Oxford House
Oxford Road
Aylesbury
HP21 8SZ",,,,,,,,,GBP,,0,,,,,,,Rotatrim Ltd,"8 Caxton Park
Elms Industrial Estate
Bedford
MK44 2DS",,,,,,,,,GBP,,,,,,,,,,,,,,,,,,,,,,,,,,,,,,,,,,,,,,,,,,,,,,,,,,,,,,,,,
https://www.contractsfinder.service.gov.uk/Published/Notice/releases/00de7042-f18b-4b22-84e2-9bd6fade1134.json,2020-04-07T13:41:02Z,DUE NORTH LIMITED,GB-GOVUK-crown_comercial_service,,https://www.contractsfinder.service.gov.uk,1.1,https://raw.githubusercontent.com/open-contracting/ocds_process_title_extension/v1.1/extension.json,https://www.nationalarchives.gov.uk/doc/open-government-licence/version/2/,https://www.gov.uk/government/publications/open-contracting,ocds-b5fd17-24cfc952-28b8-405e-b7b7-b71a072e0519,ocds-b5fd17-24cfc952-28b8-405e-b7b7-b71a072e0519-353421-ntyn001-dn473653-71176613,en-GB,2020-04-07T13:41:02Z,tender,tender,ocds-b5fd17-24cfc952-28b8-405e-b7b7-b71a072e0519-ntyn001-dn473653-71176613,"RETENDER EV076 Killingworth Sustainable Retrofit Project Sub-Contractor Packages- Block A 17. IPS Panels, Vanity Units & Cubicles","The Authority has secured funding from the European Regional Development Fund (ERDF) for the Killingworth Site Sustainable Retrofit project. This project is a combination of refurbishment and replacement of the existing office accommodation, workshop, welfare and other facilities on the site ensuring it 'future proofs' its operations, with energy efficiency and functionality as the key principles using a range of energy efficient systems, alongside energy generation and energy storage/distribution solutions to support a move to an electronic powered operational fleet.

This procurement opportunity relates specifically to IPS Panels, Vanity Units & Cubicles. North Tyneside Council will be the Principal Contractor for the project therefore tenderers should note that they will be working in the capacity of Sub-Contractor.

Tenderers must be aware that this is an operational site and as such Works must be undertaken taking into consideration neighbouring occupied buildings, vehicle movements and office and field-based employees accessing and attending the site in vehicles and on foot. Please Note: The Block A site is very restrictive for access / plant movements.

Tenderers will be required to confirm that they will comply will the Authority's minimum standards in relation to health & safety and mandatory training requirements. All operatives must hold CSCS cards, relevant training certification and any other trade/task specific relevant qualifications.

In light of the current situation with COVID 19 timescales will be confirmed with the successful contractor.",active,1,See description of related tender.,CPV,45000000,Construction work,http://cpv.data.ac.uk/code-45000000.html,,,,,,,,,,,,,,,,,,,,,,,,,,,,,,,,,,,,,,,,,,,,,,,,,,,,,,,,,,,,,,,,,,,,,,,,,,,,,,,,,,,,,50000,GBP,50000,GBP,,Open procedure,,,,,"Please apply directly to the buyer using the contact details provided, or follow the instructions given in the notice description or information section.",2020-04-07T13:41:02Z,2020-04-23T00:00:00Z,,,1,Contract start,Anticipated contract start date,2020-06-01T00:00:00Z,,2,Contract end,Anticipated contract end date,2020-09-30T00:00:00Z,,1,,Works,,,,,,North Tyneside Council,"Quadrant, Cobalt Business Park The Silverlink North",North Tyneside,,NE27 0BY,England,Julie Batey,julie.batey@northtyneside.gov.uk,7817574163,,http://www.northtyneside.gov.uk/,,,,,,,,,,,,,,,,,,,,,,,,,,,,,,,,,,,,,,,,,,,,,,,,,,,,,,,,,,,,,,,,,,,,,,,,,,,,,,,,,,,,,,,,,,,,,,,,,,,,,
https://www.contractsfinder.service.gov.uk/Published/Notice/releases/683688af-92c6-4ea5-9a93-a3b03ad7b93a.json,2020-04-07T13:38:00Z,DUE NORTH LIMITED,GB-GOVUK-crown_comercial_service,,https://www.contractsfinder.service.gov.uk,1.1,https://raw.githubusercontent.com/open-contracting/ocds_process_title_extension/v1.1/extension.json,https://www.nationalarchives.gov.uk/doc/open-government-licence/version/2/,https://www.gov.uk/government/publications/open-contracting,ocds-b5fd17-29ebb4ae-f5d7-420f-a96d-e96bbbbc0219,ocds-b5fd17-29ebb4ae-f5d7-420f-a96d-e96bbbbc0219-353420-nycc001-dn473981-40513967,en-GB,2020-04-07T13:38:00Z,award,tender,ocds-b5fd17-29ebb4ae-f5d7-420f-a96d-e96bbbbc0219-nycc001-dn473981-40513967,Provision of Groceries & Chilled Products,Provision of Groceries & Chilled Products,complete,1,See description of related tender.,CPV,15000000,"Food, beverages, tobacco and related products",http://cpv.data.ac.uk/code-15000000.html,,,,,,,,,,,,,,,,,,,,,,,,,,,,,,,,,,,,,,,,,,,,,,,,,,,,,,,,,,,,,,,,,,,,,,,,,,,,,,,,,,,,,4500000,GBP,4500000,GBP,,Other - ,,,,,,,2019-12-31T00:00:00Z,,,1,Contract start,Anticipated contract start date,2020-04-01T00:00:00Z,,2,Contract end,Anticipated contract end date,2022-03-31T00:00:00Z,,1,,Products,,,,,,North Yorkshire County Council,North Yorkshire County Council County Hall,Northallerton,,DL7 8AD,United Kingdom,Katie Longstaff,procurement@northyorks.gov.uk,+44 1609533450,,http://www.northyorks.gov.uk/,378e1e4c-7a62-4053-9b34-0fcda0c0bffa,,See description of related tender,active,2020-01-01T00:00:00Z,4500000,GBP,0,,,,,,,YPO,"41 Industrial Park, Wakefield, Yorkshire, WF2 0XE",,,,,Dear Tenders Team,,,,GBP,,,,,,,,,,,,,,,,,,,,,,,,,,,,,,,,,,,,,,,,,,,,,,,,,,,,,,,,,,,,,,,,,,,,,,,,,,,,
https://www.contractsfinder.service.gov.uk/Published/Notice/releases/3b32a159-df5f-46ce-bf02-3bd59814af27.json,2020-04-07T13:37:28Z,MINISTRY OF DEFENCE,GB-GOVUK-crown_comercial_service,,https://www.contractsfinder.service.gov.uk,1.1,https://raw.githubusercontent.com/open-contracting/ocds_process_title_extension/v1.1/extension.json,https://www.nationalarchives.gov.uk/doc/open-government-licence/version/2/,https://www.gov.uk/government/publications/open-contracting,ocds-b5fd17-c6581acc-4401-4e31-9aa3-cba1cd138b94,ocds-b5fd17-c6581acc-4401-4e31-9aa3-cba1cd138b94-353393-700424385,en-GB,2020-04-07T13:37:28Z,award,tender,ocds-b5fd17-c6581acc-4401-4e31-9aa3-cba1cd138b94-700424385,Provision of Adesoft Project File for DSEME,"Call Off Contract under Crown Commercial Service Technology Services 2 Agreement RM3804 Framework Schedule 4 (Direct Award)
Operational assistance for Adesoft Application to assist customer with planning capacity and scenario modelling for training establishments.",complete,1,See description of related tender.,CPV,72610000,Computer support services,http://cpv.data.ac.uk/code-72610000.html,,,,,,,,,,,,,,,,,,,,,,,,,,,,,,,,,,,,,,,,,,,,,,,,,,,,,,,,,,,,,,,,,,,,,,,,,,,,,,,,,,,,,40390,GBP,0,GBP,selective,Call off from a Framework Agreement,,,,,,,2020-03-23T00:00:00Z,,,1,Contract start,Anticipated contract start date,2020-03-27T00:00:00Z,,2,Contract end,Anticipated contract end date,2020-04-27T00:00:00Z,,,,Services,,GB-SRS,sid4gov.cabinetoffice.gov.uk/7U7AuvS7,https://supplierregistration.cabinetoffice.gov.uk/notices/buyers.csv,,MINISTRY OF DEFENCE,RAF High Wycombe ,Walters Ash,,HP14 4UE,England,Joanna Paish,joanna.paish100@mod.uk,,,,d82c2693-63eb-475c-a6db-0ba4cf4a7ded,,See description of related tender,active,2020-03-27T00:00:00Z,40390,GBP,0,GB-COH,1738519,,,,,Centerprise International,"Hampshire International Business Park
Lime Tree Way
Basingstoke
RG24 8GQ",,,,,,,,,GBP,40390,,,,,,,,,,,,,,,,,,,,,,,,,,,,,,,,,,,,,,,,,,,,,,,,,,,,,,,,,,,,,,,,,,,,,,,,,,,
https://www.contractsfinder.service.gov.uk/Published/Notice/releases/959658d9-4768-4949-8790-d1dffe6af3bc.json,2020-04-07T13:14:35Z,UNIVERSITY OF DERBY,GB-GOVUK-crown_comercial_service,,https://www.contractsfinder.service.gov.uk,1.1,https://raw.githubusercontent.com/open-contracting/ocds_process_title_extension/v1.1/extension.json,https://www.nationalarchives.gov.uk/doc/open-government-licence/version/2/,https://www.gov.uk/government/publications/open-contracting,ocds-b5fd17-a852b142-fc81-4f35-8328-e801ed558566,ocds-b5fd17-a852b142-fc81-4f35-8328-e801ed558566-353416-proc-jb-rfq-198,en-GB,2020-04-07T13:14:35Z,award,tender,ocds-b5fd17-a852b142-fc81-4f35-8328-e801ed558566-proc-jb-rfq-198,Architectural Services,"The University of Derby has identified a need to create a new Business School to provide a home for the College of Business Law and Social Sciences (CBLSS). The preferred site is an existing area of land, already within the University ownership, at Agard Street in Derby.

This site sits opposite the University's One Friargate Square building, and is adjacent to the existing Sir Peter Hilton Court Halls of Residence; it has been identified within the University's emerging Estate Strategy 2020-2025 as a site of strategic importance.

Delivery of the proposed Business School is critical to the on-going success of the University - in part due to the potential expansion of the CBLSS offering, but also to unlock development potential at other key sites by allowing the transfer of teaching to the new building. 

The Governing Council of the University has agreed to the development of project up to and including RIBA Stage 3 (Developed Design).",complete,1,See description of related tender.,CPV,71200000,Architectural and related services,http://cpv.data.ac.uk/code-71200000.html,,,,,,,,,,,,,,,,,,,,,,,,,,,,,,,,,,,,,,,,,,,,,,,,,,,,,,,,,,,,,,,,,,,,,,,,,,,,,,,,,,,,,200838,GBP,0,GBP,selective,Call off from a Framework Agreement,,,,,,,2020-01-17T00:00:00Z,,,1,Contract start,Anticipated contract start date,2020-03-01T00:00:00Z,,2,Contract end,Anticipated contract end date,2021-03-31T00:00:00Z,,1,,Services,,GB-SRS,sid4gov.cabinetoffice.gov.uk/hRK774t6,https://supplierregistration.cabinetoffice.gov.uk/notices/buyers.csv,,UNIVERSITY OF DERBY,Kedleston Road ,DERBY,,DE221GB,England,Jane Brailsford,procurement@derby.ac.uk,01332 592401,,,f5d58652-b136-4c25-b34c-951db18f491e,,See description of related tender,active,2020-03-02T00:00:00Z,200838,GBP,0,,,,,1,,Stride Treglown Ltd,"Promenade House
The Promenade
Clifton Down
Bristol
BS8 3NE",,,,,,,,,GBP,,,,,,,,,,,,,,,,,,,,,,,,,,,,,,,,,,,,,,,,,,,,,,,,,,,,,,,,,,,,,,,,,,,,,,,,,,,,
https://www.contractsfinder.service.gov.uk/Published/Notice/releases/9f6237b5-9366-4bb7-88a3-86335900c928.json,2020-04-07T13:07:11Z,galliford try,GB-GOVUK-crown_comercial_service,,https://www.contractsfinder.service.gov.uk,1.1,https://raw.githubusercontent.com/open-contracting/ocds_process_title_extension/v1.1/extension.json,https://www.nationalarchives.gov.uk/doc/open-government-licence/version/2/,https://www.gov.uk/government/publications/open-contracting,ocds-b5fd17-29387dd8-1548-4df2-a898-b94fca4f8e10,ocds-b5fd17-29387dd8-1548-4df2-a898-b94fca4f8e10-353415-he013-stage6-ecology,en-GB,2020-04-07T13:07:11Z,tender,tender,ocds-b5fd17-29387dd8-1548-4df2-a898-b94fca4f8e10-he013/stage6/ecology,A303 Sparkford to Ilchester Dualling Ecology,"NOTIFICATION OF SUBCONTRACT PACKAGE
A303 Sparkford to Ilchester
Galliford Try, as the South West Regional Delivery Partner are delivering the A303 Sparkford to Ilchester dualling project in the county of Somerset on behalf of Highways England. The project involves the design and construction of 5.6km of new dual lane all-purpose carriageway, connecting the existing dual carriageway at the Sparkford and Podimore Bypasses, therefore creating a continuous dual carriageway between Mere and the Podimore Roundabout.
The project is currently awaiting the approval of the Development Consent Order from the Secretary of State for Transport and this is expected to be given in early Spring 2020. Subject to receiving approval, the project is forecast to commence on site in late summer 2020 and will take around 2 years to complete.  
Package: ECOLOGY 	
Outline Scope of Works   
The ecology works are to be provided in accordance with the scope documents contained and referred to within this enquiry document. The majority of the new A303 dual carriageway sits to the north of the existing A303 however the new and existing carriageways cross at approx. ch3300 & ch3750.  
Programme
It is currently anticipated that the ecology works will commence in autumn 2021.
Timings
Deadline for Notifications of Interest	17:30hrs 13th April 2020
Deadline for tender submission  	17:30hrs 20th April 2020

If this package is of interest to your company please contact the Managing QS [Adrian Paddock] by e-mail on adrian.paddock@gallifordtry.co.uk, by the above deadline for notifications of interest and a link to the subcontract enquiry documentation can be issued.",active,1,See description of related tender.,CPV,45262640,Environmental improvement works,http://cpv.data.ac.uk/code-45262640.html,2,See description of related tender.,CPV,71313450,Environmental monitoring for construction,http://cpv.data.ac.uk/code-71313450.html,,,,,,,,,,,,,,,,,,,,,,,,,,,,,,,,,,,,,,,,,,,,,,,,,,,,,,,,,,,,,,,,,,,,,,,,,,,,,,,0,GBP,0,GBP,open,Open procedure (OJEU),,,,,"Please apply directly to the buyer using the contact details provided, or follow the instructions given in the notice description or information section.",2020-04-07T13:07:11Z,2020-04-20T00:00:00Z,,,1,Contract start,Anticipated contract start date,2021-04-01T00:00:00Z,,2,Contract end,Anticipated contract end date,2021-07-01T00:00:00Z,,,,Works,,GB-SRS,supplierregistration.cabinetoffice.gov.uk/J5Wf5fFP,https://supplierregistration.cabinetoffice.gov.uk/notices/buyers.csv,,galliford try,"5th Floor, Broad Quay House",Bristol,,BS1 4DJ,England,Adrian Paddock,Adrian.Paddock@gallifordtry.co.uk,,,,,,,,,,,,,,,,,,,,,,,,,,,,,,,,,,,,,,,,,,,,,,,,,,,,,,,,,,,,,,,,,,,,,,,,,,,,,,,,,,,,,,,,,,,,,,,,,,,,,,,,
https://www.contractsfinder.service.gov.uk/Published/Notice/releases/c94f966f-68c7-4b41-b254-977101273aff.json,2020-04-07T13:04:28Z,UK SHARED BUSINESS SERVICES LIMITED,GB-GOVUK-crown_comercial_service,,https://www.contractsfinder.service.gov.uk,1.1,https://raw.githubusercontent.com/open-contracting/ocds_process_title_extension/v1.1/extension.json,https://www.nationalarchives.gov.uk/doc/open-government-licence/version/2/,https://www.gov.uk/government/publications/open-contracting,ocds-b5fd17-e0312d74-b6f4-444d-ac39-0277e2196b41,ocds-b5fd17-e0312d74-b6f4-444d-ac39-0277e2196b41-353414-ddat20105,en-GB,2020-04-07T13:04:28Z,award,tender,ocds-b5fd17-e0312d74-b6f4-444d-ac39-0277e2196b41-ddat20105,UK SBS DDaT20105 STFC vulnerability scanning appliance,"***PLEASE NOTE THIS IS AN AWARD NOTICE, NOT A CALL FOR COMPETITION***

UK Research and Innovation - Science & Technology Facilities Council (STFC) had a requirement for the procurement of vulnerability scanning appliance with the associated licence and support for one year.

The Contract was awarded via a Call-Off against the JISC Vulnerability Assessment Services framework agreement.",complete,1,See description of related tender.,CPV,48000000,Software package and information systems,http://cpv.data.ac.uk/code-48000000.html,,,,,,,,,,,,,,,,,,,,,,,,,,,,,,,,,,,,,,,,,,,,,,,,,,,,,,,,,,,,,,,,,,,,,,,,,,,,,,,,,,,,,47375.68,GBP,0,GBP,selective,Call off from a Framework Agreement,,,,,,,2020-03-19T00:00:00Z,,,1,Contract start,Anticipated contract start date,2020-03-23T00:00:00Z,,2,Contract end,Anticipated contract end date,2021-03-22T00:00:00Z,,1,1,Products,,GB-SRS,sid4gov.cabinetoffice.gov.uk/dXGP288m,https://supplierregistration.cabinetoffice.gov.uk/notices/buyers.csv,,UK SHARED BUSINESS SERVICES LIMITED,North Star House ,SWINDON,,SN21FF,England,Nikolaos Filippis,Nikolaos.Filippis@uksbs.co.uk,,,,0621e233-a130-45ad-8004-edc75e1bf423,,See description of related tender,active,2020-03-20T00:00:00Z,47375.68,GBP,0,GB-COH,5218573,,,1,,KHIPU NETWORKS LIMITED,"Fleet27
GU51 2UH
GB",,,,,John Ayres,,,,GBP,,,,,,,,,,,,,,,,,,,,,,,,,,,,,,,,,,,,,,,,,,,,,,,,,,,,,,,,,,,,,,,,,,,,,,,,,,,,
