uri,publishedDate,publisher/name,publisher/scheme,publisher/uid,publisher/uri,version,extensions/0,license,publicationPolicy,releases/0/ocid,releases/0/id,releases/0/language,releases/0/date,releases/0/tag/0,releases/0/initiationType,releases/0/tender/id,releases/0/tender/title,releases/0/tender/description,releases/0/tender/status,releases/0/tender/items/0/id,releases/0/tender/items/0/description,releases/0/tender/items/0/classification/scheme,releases/0/tender/items/0/classification/id,releases/0/tender/items/0/classification/description,releases/0/tender/items/0/classification/uri,releases/0/tender/items/1/id,releases/0/tender/items/1/description,releases/0/tender/items/1/classification/scheme,releases/0/tender/items/1/classification/id,releases/0/tender/items/1/classification/description,releases/0/tender/items/1/classification/uri,releases/0/tender/items/2/id,releases/0/tender/items/2/description,releases/0/tender/items/2/classification/scheme,releases/0/tender/items/2/classification/id,releases/0/tender/items/2/classification/description,releases/0/tender/items/2/classification/uri,releases/0/tender/items/3/id,releases/0/tender/items/3/description,releases/0/tender/items/3/classification/scheme,releases/0/tender/items/3/classification/id,releases/0/tender/items/3/classification/description,releases/0/tender/items/3/classification/uri,releases/0/tender/items/4/id,releases/0/tender/items/4/description,releases/0/tender/items/4/classification/scheme,releases/0/tender/items/4/classification/id,releases/0/tender/items/4/classification/description,releases/0/tender/items/4/classification/uri,releases/0/tender/items/5/id,releases/0/tender/items/5/description,releases/0/tender/items/5/classification/scheme,releases/0/tender/items/5/classification/id,releases/0/tender/items/5/classification/description,releases/0/tender/items/5/classification/uri,releases/0/tender/items/6/id,releases/0/tender/items/6/description,releases/0/tender/items/6/classification/scheme,releases/0/tender/items/6/classification/id,releases/0/tender/items/6/classification/description,releases/0/tender/items/6/classification/uri,releases/0/tender/items/7/id,releases/0/tender/items/7/description,releases/0/tender/items/7/classification/scheme,releases/0/tender/items/7/classification/id,releases/0/tender/items/7/classification/description,releases/0/tender/items/7/classification/uri,releases/0/tender/items/8/id,releases/0/tender/items/8/description,releases/0/tender/items/8/classification/scheme,releases/0/tender/items/8/classification/id,releases/0/tender/items/8/classification/description,releases/0/tender/items/8/classification/uri,releases/0/tender/items/9/id,releases/0/tender/items/9/description,releases/0/tender/items/9/classification/scheme,releases/0/tender/items/9/classification/id,releases/0/tender/items/9/classification/description,releases/0/tender/items/9/classification/uri,releases/0/tender/items/10/id,releases/0/tender/items/10/description,releases/0/tender/items/10/classification/scheme,releases/0/tender/items/10/classification/id,releases/0/tender/items/10/classification/description,releases/0/tender/items/10/classification/uri,releases/0/tender/items/11/id,releases/0/tender/items/11/description,releases/0/tender/items/11/classification/scheme,releases/0/tender/items/11/classification/id,releases/0/tender/items/11/classification/description,releases/0/tender/items/11/classification/uri,releases/0/tender/items/12/id,releases/0/tender/items/12/description,releases/0/tender/items/12/classification/scheme,releases/0/tender/items/12/classification/id,releases/0/tender/items/12/classification/description,releases/0/tender/items/12/classification/uri,releases/0/tender/items/13/id,releases/0/tender/items/13/description,releases/0/tender/items/13/classification/scheme,releases/0/tender/items/13/classification/id,releases/0/tender/items/13/classification/description,releases/0/tender/items/13/classification/uri,releases/0/tender/items/14/id,releases/0/tender/items/14/description,releases/0/tender/items/14/classification/scheme,releases/0/tender/items/14/classification/id,releases/0/tender/items/14/classification/description,releases/0/tender/items/14/classification/uri,val,releases/0/tender/minValue/currency,releases/0/tender/value/amount,releases/0/tender/value/currency,releases/0/tender/procurementMethod,releases/0/tender/procurementMethodDetails,releases/0/tender/procurementMethodRationale,releases/0/tender/awardCriteria,releases/0/tender/awardCriteriaDetails,releases/0/tender/submissionMethod,releases/0/tender/submissionMethodDetails,releases/0/tender/tenderPeriod/startDate,releases/0/tender/tenderPeriod/endDate,releases/0/tender/hasEnquiries,releases/0/tender/eligibilityCriteria,releases/0/tender/milestones/0/id,releases/0/tender/milestones/0/title,releases/0/tender/milestones/0/description,releases/0/tender/milestones/0/dueDate,releases/0/tender/milestones/0/status,releases/0/tender/milestones/1/id,releases/0/tender/milestones/1/title,releases/0/tender/milestones/1/description,releases/0/tender/milestones/1/dueDate,releases/0/tender/milestones/1/status,releases/0/tender/xClassifications/isSuitableForSme,releases/0/tender/xClassifications/isSuitableForVco,releases/0/tender/xClassifications/ojeuContractType,releases/0/tender/supplyChain,releases/0/buyer/identifier/scheme,releases/0/buyer/identifier/id,releases/0/buyer/identifier/uri,releases/0/buyer/identifier/legalName,releases/0/buyer/name,releases/0/buyer/address/streetAddress,releases/0/buyer/address/locality,releases/0/buyer/address/region,releases/0/buyer/address/postalCode,releases/0/buyer/address/countryName,releases/0/buyer/contactPoint/name,releases/0/buyer/contactPoint/email,releases/0/buyer/contactPoint/telephone,releases/0/buyer/contactPoint/faxNumber,releases/0/buyer/contactPoint/uri,releases/0/awards/0/id,releases/0/awards/0/title,releases/0/awards/0/description,releases/0/awards/0/status,releases/0/awards/0/date,releases/0/awards/0/value/amount,releases/0/awards/0/value/currency,releases/0/awards/0/suppliers/0/id,releases/0/awards/0/suppliers/0/identifier/scheme,releases/0/awards/0/suppliers/0/identifier/id,releases/0/awards/0/suppliers/0/identifier/legalName,releases/0/awards/0/suppliers/0/identifier/uri,releases/0/awards/0/suppliers/0/sme,releases/0/awards/0/suppliers/0/vco,releases/0/awards/0/suppliers/0/name,releases/0/awards/0/suppliers/0/address/streetAddress,releases/0/awards/0/suppliers/0/address/locality,releases/0/awards/0/suppliers/0/address/region,releases/0/awards/0/suppliers/0/address/postalCode,releases/0/awards/0/suppliers/0/address/countryName,releases/0/awards/0/suppliers/0/contactPoint/name,releases/0/awards/0/suppliers/0/contactPoint/email,releases/0/awards/0/suppliers/0/contactPoint/telephone,releases/0/awards/0/suppliers/0/contactPoint/faxNumber,releases/0/awards/0/suppliers/0/x_awardValue/currency,releases/0/awards/0/suppliers/0/x_awardValue/amount,releases/0/awards/0/suppliers/1/id,releases/0/awards/0/suppliers/1/identifier/scheme,releases/0/awards/0/suppliers/1/identifier/id,releases/0/awards/0/suppliers/1/identifier/legalName,releases/0/awards/0/suppliers/1/identifier/uri,releases/0/awards/0/suppliers/1/sme,releases/0/awards/0/suppliers/1/vco,releases/0/awards/0/suppliers/1/name,releases/0/awards/0/suppliers/1/address/streetAddress,releases/0/awards/0/suppliers/1/address/locality,releases/0/awards/0/suppliers/1/address/region,releases/0/awards/0/suppliers/1/address/postalCode,releases/0/awards/0/suppliers/1/address/countryName,releases/0/awards/0/suppliers/1/contactPoint/name,releases/0/awards/0/suppliers/1/contactPoint/email,releases/0/awards/0/suppliers/1/contactPoint/telephone,releases/0/awards/0/suppliers/1/contactPoint/faxNumber,releases/0/awards/0/suppliers/1/x_awardValue/currency,releases/0/awards/0/suppliers/1/x_awardValue/amount,releases/0/awards/0/suppliers/2/id,releases/0/awards/0/suppliers/2/identifier/scheme,releases/0/awards/0/suppliers/2/identifier/id,releases/0/awards/0/suppliers/2/identifier/legalName,releases/0/awards/0/suppliers/2/identifier/uri,releases/0/awards/0/suppliers/2/sme,releases/0/awards/0/suppliers/2/vco,releases/0/awards/0/suppliers/2/name,releases/0/awards/0/suppliers/2/address/streetAddress,releases/0/awards/0/suppliers/2/address/locality,releases/0/awards/0/suppliers/2/address/region,releases/0/awards/0/suppliers/2/address/postalCode,releases/0/awards/0/suppliers/2/address/countryName,releases/0/awards/0/suppliers/2/contactPoint/name,releases/0/awards/0/suppliers/2/contactPoint/email,releases/0/awards/0/suppliers/2/contactPoint/telephone,releases/0/awards/0/suppliers/2/contactPoint/faxNumber,releases/0/awards/0/suppliers/2/x_awardValue/currency,releases/0/awards/0/suppliers/2/x_awardValue/amount,releases/0/awards/0/suppliers/3/id,releases/0/awards/0/suppliers/3/identifier/scheme,releases/0/awards/0/suppliers/3/identifier/id,releases/0/awards/0/suppliers/3/identifier/legalName,releases/0/awards/0/suppliers/3/identifier/uri,releases/0/awards/0/suppliers/3/sme,releases/0/awards/0/suppliers/3/vco,releases/0/awards/0/suppliers/3/name,releases/0/awards/0/suppliers/3/address/streetAddress,releases/0/awards/0/suppliers/3/address/locality,releases/0/awards/0/suppliers/3/address/region,releases/0/awards/0/suppliers/3/address/postalCode,releases/0/awards/0/suppliers/3/address/countryName,releases/0/awards/0/suppliers/3/contactPoint/name,releases/0/awards/0/suppliers/3/contactPoint/email,releases/0/awards/0/suppliers/3/contactPoint/telephone,releases/0/awards/0/suppliers/3/contactPoint/faxNumber,releases/0/awards/0/suppliers/3/x_awardValue/currency,releases/0/awards/0/suppliers/3/x_awardValue/amount,releases/0/awards/0/suppliers/4/id,releases/0/awards/0/suppliers/4/identifier/scheme,releases/0/awards/0/suppliers/4/identifier/id,releases/0/awards/0/suppliers/4/identifier/legalName,releases/0/awards/0/suppliers/4/identifier/uri,releases/0/awards/0/suppliers/4/sme,releases/0/awards/0/suppliers/4/vco,releases/0/awards/0/suppliers/4/name,releases/0/awards/0/suppliers/4/address/streetAddress,releases/0/awards/0/suppliers/4/address/locality,releases/0/awards/0/suppliers/4/address/region,releases/0/awards/0/suppliers/4/address/postalCode,releases/0/awards/0/suppliers/4/address/countryName,releases/0/awards/0/suppliers/4/contactPoint/name,releases/0/awards/0/suppliers/4/contactPoint/email,releases/0/awards/0/suppliers/4/contactPoint/telephone,releases/0/awards/0/suppliers/4/contactPoint/faxNumber,releases/0/awards/0/suppliers/4/x_awardValue/currency
https://www.contractsfinder.service.gov.uk/Published/Notice/releases/b9d55925-f016-463f-a239-441dc83da567.json,2020-04-07T21:03:42Z,"INTERCHURCH MEDICAL ASSISTANCE, INC. (IMA WORLD HEALTH)",GB-GOVUK-crown_comercial_service,,https://www.contractsfinder.service.gov.uk,1.1,https://raw.githubusercontent.com/open-contracting/ocds_process_title_extension/v1.1/extension.json,https://www.nationalarchives.gov.uk/doc/open-government-licence/version/2/,https://www.gov.uk/government/publications/open-contracting,ocds-b5fd17-c86e0e97-617d-407e-be2c-735fa24a7f78,ocds-b5fd17-c86e0e97-617d-407e-be2c-735fa24a7f78-353526-rfq-fy20-059-drc-020,en-GB,2020-04-07T21:03:42Z,tender,tender,ocds-b5fd17-c86e0e97-617d-407e-be2c-735fa24a7f78-rfq-fy20-059-drc-020,"Supply and delivery of Personal Protection Equipment to Kinshasa, DRC",IMA World Health invites qualified suppliers to submit offers in accordance with the requirements and specifications listed in the attached RFQ document.  Please refer to the RFQ for additional details on product specifications.,active,1,See description of related tender.,CPV,33000000,"Medical equipments, pharmaceuticals and personal care products",http://cpv.data.ac.uk/code-33000000.html,,,,,,,,,,,,,,,,,,,,,,,,,,,,,,,,,,,,,,,,,,,,,,,,,,,,,,,,,,,,,,,,,,,,,,,,,,,,,,,,,,,,,400000,GBP,0,GBP,selective,Competitive procedure with negotiation (OJEU),"The urgent supply and delivery of PPEs to Kinshasa, DRC is necessary to help support the fight against COVID-19.",,,,"Please apply directly to the buyer using the contact details provided, or follow the instructions given in the notice description or information section.",2020-04-07T21:03:41Z,2020-04-16T00:00:00Z,,,1,Contract start,Anticipated contract start date,2020-04-17T00:00:00Z,,2,Contract end,Anticipated contract end date,2020-05-15T00:00:00Z,,,,Products,,GB-SRS,supplierregistration.cabinetoffice.gov.uk/nJx826Ya,https://supplierregistration.cabinetoffice.gov.uk/notices/buyers.csv,,"INTERCHURCH MEDICAL ASSISTANCE, INC. (IMA WORLD HEALTH)",1730 M ST NW STE 1100,Washington,,E1 6AN,England,Igor Samac,procurement@imaworldhealth.org,2028886200,,https://imaworldhealth.org/,,,,,,,,,,,,,,,,,,,,,,,,,,,,,,,,,,,,,,,,,,,,,,,,,,,,,,,,,,,,,,,,,,,,,,,,,,,,,,,,,,,,,,,,,,,,,,,,,,,,,
https://www.contractsfinder.service.gov.uk/Published/Notice/releases/d0e7ec82-2ffa-4500-bd5d-812b84fc7040.json,2020-04-07T19:00:37Z,BIP SOLUTIONS LIMITED,GB-GOVUK-crown_comercial_service,,https://www.contractsfinder.service.gov.uk,1.1,https://raw.githubusercontent.com/open-contracting/ocds_process_title_extension/v1.1/extension.json,https://www.nationalarchives.gov.uk/doc/open-government-licence/version/2/,https://www.gov.uk/government/publications/open-contracting,ocds-b5fd17-2335304c-9668-4a1f-ac16-3b41da6c90c6,ocds-b5fd17-2335304c-9668-4a1f-ac16-3b41da6c90c6-353525-bip486839330,en-GB,2020-04-07T19:00:37Z,award,tender,ocds-b5fd17-2335304c-9668-4a1f-ac16-3b41da6c90c6-bip486839330,GB-Sheffield: Grayce,Grayce project analysts to support in Project Management and Business Analyst activities,complete,1,See description of related tender.,CPV,72224000,Project management consultancy services,http://cpv.data.ac.uk/code-72224000.html,,,,,,,,,,,,,,,,,,,,,,,,,,,,,,,,,,,,,,,,,,,,,,,,,,,,,,,,,,,,,,,,,,,,,,,,,,,,,,,,,,,,,300000,GBP,0,GBP,,Not specified,,,,,,,2020-03-03T00:00:00Z,,,1,Contract start,Anticipated contract start date,2020-04-01T00:00:00Z,,2,Contract end,Anticipated contract end date,2021-03-31T00:00:00Z,,,,Services,,,,,,British Business Bank,Steel City House West Street,Sheffield,,S1 2GQ,UK,Procurement,Procurement@british-business-bank.co.uk,2039051462,,,af4fcc9a-fdfa-43b7-a4b2-83abc6d22293,,See description of related tender,active,2020-03-03T00:00:00Z,300000,GBP,0,,,,,,,Grayce Britain Limited,"83 Ducie Street
        Manchester
        M1 2JQ",,,,,director,,,,GBP,,,,,,,,,,,,,,,,,,,,,,,,,,,,,,,,,,,,,,,,,,,,,,,,,,,,,,,,,,,,,,,,,,,,,,,,,,,,
https://www.contractsfinder.service.gov.uk/Published/Notice/releases/dca15b60-5201-4925-ab1c-9a45eea77096.json,2020-04-07T17:45:04Z,MILLSTREAM ASSOCIATES LTD,GB-GOVUK-crown_comercial_service,,https://www.contractsfinder.service.gov.uk,1.1,https://raw.githubusercontent.com/open-contracting/ocds_process_title_extension/v1.1/extension.json,https://www.nationalarchives.gov.uk/doc/open-government-licence/version/2/,https://www.gov.uk/government/publications/open-contracting,ocds-b5fd17-5ef2cbbb-dfaf-4139-9eac-ff6f0cc407c0,ocds-b5fd17-5ef2cbbb-dfaf-4139-9eac-ff6f0cc407c0-353522-mt219467,en-GB,2020-04-07T17:45:04Z,award,tender,ocds-b5fd17-5ef2cbbb-dfaf-4139-9eac-ff6f0cc407c0-mt219467,Preparedness of recent medical graduates to meet anticipated healthcare needs,"This research aims to understand to what extent recent graduates (i.e. doctors in foundation training) are prepared to meet specific anticipated healthcare needs. The proposed research approach is to explore whether graduate doctors have the skills, capabilities and attributes to meet the needs identified within three focus themes:
The changing patient-doctor relationship
The doctor in a multi-disciplinary team
Complex clinical decision making
The findings of this research will support our engagement with the development of the NHS People Plan and other workforce planning, as well as informing any further review/updating of our regulation of the undergraduate medical education or foundation programme.",complete,1,See description of related tender.,CPV,73110000,Research services,http://cpv.data.ac.uk/code-73110000.html,2,See description of related tender.,CPV,73200000,Research and development consultancy services,http://cpv.data.ac.uk/code-73200000.html,3,See description of related tender.,CPV,79315000,Social research services,http://cpv.data.ac.uk/code-79315000.html,,,,,,,,,,,,,,,,,,,,,,,,,,,,,,,,,,,,,,,,,,,,,,,,,,,,,,,,,,,,,,,,,,,,,,,,,100000,GBP,0,GBP,,Open procedure,,,,,,,2020-02-12T00:00:00Z,,,1,Contract start,Anticipated contract start date,2020-03-03T00:00:00Z,,2,Contract end,Anticipated contract end date,2020-12-31T00:00:00Z,,1,,Services,,,,,,General Medical Council,General Medical Council 3 Hardman Street,Manchester,,M3 3AW,England,Lawrence Paddon,gmctender@gmc-uk.org,+44 1619236340,,http://www.gmc-uk.org,59407d3b-99ac-42d9-950e-e5c7703a70ff,,See description of related tender,active,2020-03-03T00:00:00Z,100000,GBP,0,,,,,,,University Of Plymouth,"Peninsula Medical School , Portland Square, Drake Circus, Plymouth",,,,,Dr Thomas Gale,,,,GBP,,,,,,,,,,,,,,,,,,,,,,,,,,,,,,,,,,,,,,,,,,,,,,,,,,,,,,,,,,,,,,,,,,,,,,,,,,,,
https://www.contractsfinder.service.gov.uk/Published/Notice/releases/e34600c3-1640-467f-8d4f-ad678417ba87.json,2020-04-07T17:45:04Z,MILLSTREAM ASSOCIATES LTD,GB-GOVUK-crown_comercial_service,,https://www.contractsfinder.service.gov.uk,1.1,https://raw.githubusercontent.com/open-contracting/ocds_process_title_extension/v1.1/extension.json,https://www.nationalarchives.gov.uk/doc/open-government-licence/version/2/,https://www.gov.uk/government/publications/open-contracting,ocds-b5fd17-5e2fec19-c387-47d6-acf8-9ca711272efe,ocds-b5fd17-5e2fec19-c387-47d6-acf8-9ca711272efe-353523-mt219466,en-GB,2020-04-07T17:45:04Z,award,tender,ocds-b5fd17-5e2fec19-c387-47d6-acf8-9ca711272efe-mt219466,"Design, deliver & support training on 'Professional Response to Embedding Lessons from Sexual Abuse'",To appoint a supplier to train a group of GMC colleagues who will be responsible for delivering training to the wider organisation on the topic of sexual misconduct or sexual harassment. The supplier will also work with the group to develop materials they can use to train colleagues across the GMC.,complete,1,See description of related tender.,CPV,80000000,Education and training services,http://cpv.data.ac.uk/code-80000000.html,2,See description of related tender.,CPV,80500000,Training services,http://cpv.data.ac.uk/code-80500000.html,3,See description of related tender.,CPV,80510000,Specialist training services,http://cpv.data.ac.uk/code-80510000.html,4,See description of related tender.,CPV,80511000,Staff training services,http://cpv.data.ac.uk/code-80511000.html,5,See description of related tender.,CPV,80521000,Training programme services,http://cpv.data.ac.uk/code-80521000.html,,,,,,,,,,,,,,,,,,,,,,,,,,,,,,,,,,,,,,,,,,,,,,,,,,,,,,,,,,,,,90000,GBP,0,GBP,,Open procedure,,,,,,,2020-02-12T00:00:00Z,,,1,Contract start,Anticipated contract start date,2020-03-11T00:00:00Z,,2,Contract end,Anticipated contract end date,2023-03-10T00:00:00Z,,1,,Services,,,,,,General Medical Council,General Medical Council 3 Hardman Street,Manchester,,M3 3AW,England,Lawrence Paddon,gmctender@gmc-uk.org,+44 1619236340,,http://www.gmc-uk.org,70bb9c9d-8f84-4df5-801a-76ac386ae9a1,,See description of related tender,active,2020-03-03T00:00:00Z,90000,GBP,0,,,,,,,Wmrsasc,"Grove House, Loves Grove, Worcester",,,,,Kerrie Best,,,,GBP,,,,,,,,,,,,,,,,,,,,,,,,,,,,,,,,,,,,,,,,,,,,,,,,,,,,,,,,,,,,,,,,,,,,,,,,,,,,
https://www.contractsfinder.service.gov.uk/Published/Notice/releases/5f966d4f-9ca9-49b4-8440-882fe3f647df.json,2020-04-07T17:45:04Z,MILLSTREAM ASSOCIATES LTD,GB-GOVUK-crown_comercial_service,,https://www.contractsfinder.service.gov.uk,1.1,https://raw.githubusercontent.com/open-contracting/ocds_process_title_extension/v1.1/extension.json,https://www.nationalarchives.gov.uk/doc/open-government-licence/version/2/,https://www.gov.uk/government/publications/open-contracting,ocds-b5fd17-b1757061-9eba-4701-b7ff-8f10223ff890,ocds-b5fd17-b1757061-9eba-4701-b7ff-8f10223ff890-353524-mt219469,en-GB,2020-04-07T17:45:04Z,award,tender,ocds-b5fd17-b1757061-9eba-4701-b7ff-8f10223ff890-mt219469,Drivers of international migration of doctors to and from the United Kingdom,"The aim of the research is to use available evidence to a) understand the flow of doctors to and from the UK; and b) describe the migration push and pull factors. The research should explore the complex range of factors driving international migration of doctors, comparing the situation in the UK with other high-income countries.
It is hoped that as well as summarising knowledge on this topic, the research will put the GMC in a stronger position to anticipate and where necessary respond to trends and factors that are impacting the migration of doctors. It is hoped that the research will have direct implications for GMC operational planning as well as contributing to the wider debate on workforce planning.",complete,1,See description of related tender.,CPV,73000000,Research and development services and related consultancy services,http://cpv.data.ac.uk/code-73000000.html,2,See description of related tender.,CPV,73110000,Research services,http://cpv.data.ac.uk/code-73110000.html,3,See description of related tender.,CPV,73200000,Research and development consultancy services,http://cpv.data.ac.uk/code-73200000.html,4,See description of related tender.,CPV,73210000,Research consultancy services,http://cpv.data.ac.uk/code-73210000.html,5,See description of related tender.,CPV,73300000,Design and execution of research and development,http://cpv.data.ac.uk/code-73300000.html,6,See description of related tender.,CPV,79315000,Social research services,http://cpv.data.ac.uk/code-79315000.html,,,,,,,,,,,,,,,,,,,,,,,,,,,,,,,,,,,,,,,,,,,,,,,,,,,,,,,50000,GBP,0,GBP,,Open procedure,,,,,,,2019-11-22T00:00:00Z,,,1,Contract start,Anticipated contract start date,2019-12-13T00:00:00Z,,2,Contract end,Anticipated contract end date,2020-07-31T00:00:00Z,,1,,Services,,,,,,General Medical Council (GMC),General Medical Council 3 Hardman Street,Manchester,,M3 3AW,England,Lawrence Paddon,gmctender@gmc-uk.org,+44 1619236340,,http://www.gmc-uk.org,76b3d22a-2ee7-4cad-a1f9-38924680621b,,See description of related tender,active,2019-12-06T00:00:00Z,50000,GBP,0,,,,,,,Plymouth University,"Drake Circus, , Plymouth",,,,,Dr Nicola Brennan,,,,GBP,,,,,,,,,,,,,,,,,,,,,,,,,,,,,,,,,,,,,,,,,,,,,,,,,,,,,,,,,,,,,,,,,,,,,,,,,,,,
